StartDate,EndDate,Status,IPAddress,Progress,Duration..in.seconds.,Finished,RecordedDate,ResponseId,RecipientLastName,RecipientFirstName,RecipientEmail,ExternalReference,LocationLatitude,LocationLongitude,DistributionChannel,UserLanguage,Q70_First.Click,Q70_Last.Click,Q70_Page.Submit,Q70_Click.Count,Q76_First.Click,Q76_Last.Click,Q76_Page.Submit,Q76_Click.Count,Q82_First.Click,Q82_Last.Click,Q82_Page.Submit,Q82_Click.Count,Q86_First.Click,Q86_Last.Click,Q86_Page.Submit,Q86_Click.Count,Q64_First.Click,Q64_Last.Click,Q64_Page.Submit,Q64_Click.Count,hb_1,hb_2,hb_3,hb_4,hb_check_5,Q38_First.Click,Q38_Last.Click,Q38_Page.Submit,Q38_Click.Count,nat_1,nat_2r,nat_3,nat_4,nat_5,nat_6r,Q39_First.Click,Q39_Last.Click,Q39_Page.Submit,Q39_Click.Count,medSkept_1,medSkept_2r,medSkept_3,medSkept_4,medSkept_5r,medSkept_6r,Q40_First.Click,Q40_Last.Click,Q40_Page.Submit,Q40_Click.Count,diseaseRare_1,diseaseRare_2,diseaseRare_3r,diseaseRare_4,diseaseRare_5r,Q41_First.Click,Q41_Last.Click,Q41_Page.Submit,Q41_Click.Count,diseaseSevere_1r,diseaseSevere_2,diseaseSevere_3,diseaseSevere_4r,diseaseSevere_5,Q44_First.Click,Q44_Last.Click,Q44_Page.Submit,Q44_Click.Count,vaccEff_1,vaccEff_2r,vaccEff_3r,vaccEff_4,vaccEff_check_1,Q45_First.Click,Q45_Last.Click,Q45_Page.Submit,Q45_Click.Count,vaccDanger_1,vaccDanger_2r,vaccDanger_3,vaccDanger_4r,vaccDanger_check_3,Q46_First.Click,Q46_Last.Click,Q46_Page.Submit,Q46_Click.Count,vaccTox_1r,vaccTox_2,vaccTox_3,vaccTox_4r,vaccTox_check_6,Q47_First.Click,Q47_Last.Click,Q47_Page.Submit,Q47_Click.Count,vaccStrain_1,vaccStrain_2r,vaccStrain_3,vaccStrain_4r,vaccStrain_5,Q48_First.Click,Q48_Last.Click,Q48_Page.Submit,Q48_Click.Count,vaccIntent_1r,vaccIntent_2,vaccIntent_3r,vaccIntent_4,vaccIntent_5r,Q49_First.Click,Q49_Last.Click,Q49_Page.Submit,Q49_Click.Count,parentExpert_1,parentExpert_2,parentExpert_3,parentExpert_4r,parentExpert_5r,Q50_First.Click,Q50_Last.Click,Q50_Page.Submit,Q50_Click.Count,infantImmLimCap_1,infantImmLimCap_2r,infantImmLimCap_3,infantImmLimCap_4,infantImmLimCap_5r,Q51_First.Click,Q51_Last.Click,Q51_Page.Submit,Q51_Click.Count,infantImmWeak_1,infantImmWeak_2,infantImmWeak_3,infantImmWeak_4r,infantImmWeak_5r,Q52_First.Click,Q52_Last.Click,Q52_Page.Submit,Q52_Click.Count,overpar_1,overpar_2,overpar_3,overpar_4r,overpar_5r,Q53_First.Click,Q53_Last.Click,Q53_Page.Submit,Q53_Click.Count,Q48,Q50,Q52,Q54,Q56,Q58,Q60,Q62,Q64,Q66,Q68,Q70,Q72,Q74,comments,workerId,assignmentId,hitId,study_time,payment,condition
Start Date,End Date,Response Type,07ceb499159bef0b,Progress,Duration (in seconds),Finished,Recorded Date,Response ID,Recipient Last Name,Recipient First Name,Recipient Email,External Data Reference,NA,NA,Distribution Channel,User Language,Timing - First Click,Timing - Last Click,Timing - Page Submit,Timing - Click Count,Timing - First Click,Timing - Last Click,Timing - Page Submit,Timing - Click Count,Timing - First Click,Timing - Last Click,Timing - Page Submit,Timing - Click Count,Timing - First Click,Timing - Last Click,Timing - Page Submit,Timing - Click Count,Timing - First Click,Timing - Last Click,Timing - Page Submit,Timing - Click Count,Please indicate how much you agree or disagree with each of the following statements. - The body is essentially self-healing and the task of a health care provider is to assist the healing process.,Please indicate how much you agree or disagree with each of the following statements. - Physical and mental health are maintained by an underlying energy or vital force.,Please indicate how much you agree or disagree with each of the following statements. - A patient’s symptoms should be regarded as a manifestation of a general imbalance or dysfunction affecting the whole body.,Please indicate how much you agree or disagree with each of the following statements. - Health and disease are a reflection of balance between positive life enhancing forces and negative destructive forces.,Please indicate how much you agree or disagree with each of the following statements. - Please select somewhat agree.,Timing - First Click,Timing - Last Click,Timing - Page Submit,Timing - Click Count,Please indicate how much you agree or disagree with each of the following statements. - Natural things are always better than synthetic alternatives.,"Please indicate how much you agree or disagree with each of the following statements. - In some cases, it’s fair to say that science has improved on nature.",Please indicate how much you agree or disagree with each of the following statements. - I’m always wary of any chemicals that were developed in a lab.,"Please indicate how much you agree or disagree with each of the following statements. - Overall, advances in chemistry and the creation of synthetic chemicals have done more harm than good for human health.",Please indicate how much you agree or disagree with each of the following statements. - Childbirth should take place at home rather than in a hospital.,Please indicate how much you agree or disagree with each of the following statements. - I’m not concerned about preservatives in food.,Timing - First Click,Timing - Last Click,Timing - Page Submit,Timing - Click Count,Please indicate how much you agree or disagree with each of the following statements. - Pharmaceutical companies are more interested in making money than in helping people be healthy.,Please indicate how much you agree or disagree with each of the following statements. - FDA regulations ensure that approved pharmaceutical drugs are safe.,Please indicate how much you agree or disagree with each of the following statements. - Pharmaceutical companies put pressure on the FDA and CDC to suppress negative findings.,Please indicate how much you agree or disagree with each of the following statements. - Most researchers are biased against the idea that medications or vaccinations could cause health problems.,Please indicate how much you agree or disagree with each of the following statements. - Pharmaceutical companies don’t make huge profits from the sale of vaccines.,"Please indicate how much you agree or disagree with each of the following statements. - For researchers developing vaccines, safety is a top priority.",Timing - First Click,Timing - Last Click,Timing - Page Submit,Timing - Click Count,Please indicate how much you agree or disagree with each of the following statements. - Diseases like measles and whooping cough are so rare that there is no real need to worry about them.,Please indicate how much you agree or disagree with each of the following statements. - Nowadays parents can feel certain their children will not contract measles or mumps.,Please indicate how much you agree or disagree with each of the following statements. - It’s not  paranoid for parents to  worry about their children getting measles.,Please indicate how much you agree or disagree with each of the following statements. - It is almost impossible for a child currently living in the US to catch whooping cough.,Please indicate how much you agree or disagree with each of the following statements. - Measles and whooping cough are more common than people realize.,Timing - First Click,Timing - Last Click,Timing - Page Submit,Timing - Click Count,"Please indicate how much you agree or disagree with each of the following statements. - Measles, mumps, and whooping cough are no more severe than the flu.",Please indicate how much you agree or disagree with each of the following statements. - Childhood diseases are serious diseases.,"Please indicate how much you agree or disagree with each of the following statements. - Diseases like measles, mumps, and whooping cough can cause permanent damage to a child who contracts them.",Please indicate how much you agree or disagree with each of the following statements. - Childhood diseases are not that big a deal.,Please indicate how much you agree or disagree with each of the following statements. - Diseases like measles and whooping cough are extremely dangerous for young children.,Timing - First Click,Timing - Last Click,Timing - Page Submit,Timing - Click Count,Please indicate how much you agree or disagree with each of the following statements. - Your chances of getting a disease after being vaccinated against it are incredibly low.,Please indicate how much you agree or disagree with each of the following statements. - Improved nutrition and sanitation played a larger role than vaccines in the decline of diseases like measles.,Please indicate how much you agree or disagree with each of the following statements. - Recent outbreaks of diseases like measles and whooping cough show that vaccines don’t work very well.,Please indicate how much you agree or disagree with each of the following statements. - Vaccines are one of the most effective medical treatments.,Please indicate how much you agree or disagree with each of the following statements. - Please select strongly disagree.,Timing - First Click,Timing - Last Click,Timing - Page Submit,Timing - Click Count,Please indicate how much you agree or disagree with each of the following statements. - Childhood vaccines can cause autism.,Please indicate how much you agree or disagree with each of the following statements. - It is safe for infants to receive multiple vaccines at once.,Please indicate how much you agree or disagree with each of the following statements. - Many children have severe adverse reactions to the MMR vaccine.,Please indicate how much you agree or disagree with each of the following statements. - Vaccines are a very safe medical treatment.,Please indicate how much you agree or disagree with each of the following statements. - Please select somewhat disagree.,Timing - First Click,Timing - Last Click,Timing - Page Submit,Timing - Click Count,Please indicate how much you agree or disagree with each of the following statements. - Vaccines do not contain dangerous amounts of toxins.,Please indicate how much you agree or disagree with each of the following statements. - Vaccines are actually highly toxic to humans.,Please indicate how much you agree or disagree with each of the following statements. - Exposure to certain additives in vaccines can cause major health problems.,Please indicate how much you agree or disagree with each of the following statements. - The quantities of chemical additives in vaccines are so small that they do not pose any health risks.,Please indicate how much you agree or disagree with each of the following statements. - Please select agree.,Timing - First Click,Timing - Last Click,Timing - Page Submit,Timing - Click Count,Please indicate how much you agree or disagree with each of the following statements. - Vaccines strain the immune system much like the actual disease.,Please indicate how much you agree or disagree with each of the following statements. - One great benefit of vaccines is that they provide immunity without the immune system having to work so hard.,"Please indicate how much you agree or disagree with each of the following statements. - Vaccines can use up the capacity of the immune system, leaving a baby vulnerable.",Please indicate how much you agree or disagree with each of the following statements. - Vaccines are not very taxing for an infant's immune system.,Please indicate how much you agree or disagree with each of the following statements. - Getting multiple vaccines at once can exhaust an infant’s immune system.,Timing - First Click,Timing - Last Click,Timing - Page Submit,Timing - Click Count,Please indicate how much you agree or disagree with each of the following statements. - The risk of side effects outweighs any protective benefits of vaccines.,Please indicate how much you agree or disagree with each of the following statements. - If I had a young baby I would have him or her vaccinated.,"Please indicate how much you agree or disagree with each of the following statements. - If I had a baby, I would opt to spread out his or her vaccinations, rather than following the traditional schedule.",Please indicate how much you agree or disagree with each of the following statements. - I feel confident that vaccinating children is the right thing to do.,Please indicate how much you agree or disagree with each of the following statements. - I would never vaccinate my child.,Timing - First Click,Timing - Last Click,Timing - Page Submit,Timing - Click Count,Please indicate how much you agree or disagree with each of the following statements. - Every individual is different and a parent knows their own child best.,Please indicate how much you agree or disagree with each of the following statements. - Parents have insights into their children’s health and well-being that no health professional can match.,"Please indicate how much you agree or disagree with each of the following statements. - When a child encounters health problems, the child’s parents are often better equipped than doctors to identify the many subtle causes of those issues.",Please indicate how much you agree or disagree with each of the following statements. - Parents should trust a doctor’s advice even if it goes against their intuitions.,Please indicate how much you agree or disagree with each of the following statements. - Advice from doctors is the best resource for keeping your child healthy.,Timing - First Click,Timing - Last Click,Timing - Page Submit,Timing - Click Count,Please indicate how much you agree or disagree with each of the following statements. - When babies are exposed to one illness it leaves them especially vulnerable to other viruses and infections.,Please indicate how much you agree or disagree with each of the following statements. - Babies are able to fight off multiple viruses at the same time.,Please indicate how much you agree or disagree with each of the following statements. - Babies’ immune systems can only develop a limited number of antibodies.,Please indicate how much you agree or disagree with each of the following statements. - Babies’ immune systems are severely limited in how much they can cope with at one time.,Please indicate how much you agree or disagree with each of the following statements. - Babies’ immune systems can deal with many threats at one time.,Timing - First Click,Timing - Last Click,Timing - Page Submit,Timing - Click Count,Please indicate how much you agree or disagree with each of the following statements. - Babies should be sheltered from exposure to viruses and bacteria to the greatest extent possible.,Please indicate how much you agree or disagree with each of the following statements. - Babies have a very limited ability to fight off diseases.,Please indicate how much you agree or disagree with each of the following statements. - Babies’ immune systems are weak.,Please indicate how much you agree or disagree with each of the following statements. - Babies have an innate ability to fight off diseases.,Please indicate how much you agree or disagree with each of the following statements. - Babies’ immune systems are more robust than many people think.,Timing - First Click,Timing - Last Click,Timing - Page Submit,Timing - Click Count,Please indicate how much you agree or disagree with each of the following statements. - Parents should strive to control their baby’s environments as much as possible.,Please indicate how much you agree or disagree with each of the following statements. - Parents of babies should never leave anything to chance.,Please indicate how much you agree or disagree with each of the following statements. - There is no such thing as being overprotective of a baby.,Please indicate how much you agree or disagree with each of the following statements. - Many things that parents of babies worry about won’t actually have major consequences.,Please indicate how much you agree or disagree with each of the following statements. - Some parents go overboard trying to make everything perfect for their babies.,Timing - First Click,Timing - Last Click,Timing - Page Submit,Timing - Click Count,Are you a parent?,How many children do you have?,How old is your oldest child?,How old is your youngest child? If you only have one child you may leave this blank.,Do you plan or hope to be a parent someday?,Have you had a flu shot this flu season?,Do you expect to get a flu shot next flu season?,Have any of your children had a flu shot this flu season?,Do you expect that any of your children will get a flu shot next flu season?,Have you ever chosen to delay or to spread out your child’s vaccinations instead of following the schedule recommended by your child's doctor?,Have you ever refused or decided to skip a vaccine the doctor recommended for your child?,Have you ever obtained a exemption for your child to attend school without required vaccinations?,"Please be honest when answering the following question. Your answer will not affect your payment or eligibility for future studies.

  
The study you have just participated in is a psychological study aimed at understanding human cognition and behavior. Psychological research depends on participants like you. Your responses to surveys like this one are an incredibly valuable source of data for researchers. It is therefore crucial for research that participants pay attention, avoid distractions, and take all study tasks seriously (even when they might seem silly). 
Do you feel that you paid attention, avoided distractions, and took this survey seriously?",Thank you for your participation. Do you have any final thoughts you want to let us know about the study you just completed?,Thank you for your participation in this study. Do you have any comments about the study or about your responses?,b953548792ca98d5,assignmentId,hitId,study_time,payment,condition
"{""ImportId"":""startDate"",""timeZone"":""America/Denver""}","{""ImportId"":""endDate"",""timeZone"":""America/Denver""}","{""ImportId"":""status""}",c91890b20bf88706,"{""ImportId"":""progress""}","{""ImportId"":""duration""}","{""ImportId"":""finished""}","{""ImportId"":""recordedDate"",""timeZone"":""America/Denver""}","{""ImportId"":""_recordId""}","{""ImportId"":""recipientLastName""}","{""ImportId"":""recipientFirstName""}","{""ImportId"":""recipientEmail""}","{""ImportId"":""externalDataReference""}",NA,NA,"{""ImportId"":""distributionChannel""}","{""ImportId"":""userLanguage""}","{""ImportId"":""QID139_FIRST_CLICK""}","{""ImportId"":""QID139_LAST_CLICK""}","{""ImportId"":""QID139_PAGE_SUBMIT""}","{""ImportId"":""QID139_CLICK_COUNT""}","{""ImportId"":""QID142_FIRST_CLICK""}","{""ImportId"":""QID142_LAST_CLICK""}","{""ImportId"":""QID142_PAGE_SUBMIT""}","{""ImportId"":""QID142_CLICK_COUNT""}","{""ImportId"":""QID145_FIRST_CLICK""}","{""ImportId"":""QID145_LAST_CLICK""}","{""ImportId"":""QID145_PAGE_SUBMIT""}","{""ImportId"":""QID145_CLICK_COUNT""}","{""ImportId"":""QID147_FIRST_CLICK""}","{""ImportId"":""QID147_LAST_CLICK""}","{""ImportId"":""QID147_PAGE_SUBMIT""}","{""ImportId"":""QID147_CLICK_COUNT""}","{""ImportId"":""QID165_FIRST_CLICK""}","{""ImportId"":""QID165_LAST_CLICK""}","{""ImportId"":""QID165_PAGE_SUBMIT""}","{""ImportId"":""QID165_CLICK_COUNT""}","{""ImportId"":""QID82_4""}","{""ImportId"":""QID82_5""}","{""ImportId"":""QID82_6""}","{""ImportId"":""QID82_7""}","{""ImportId"":""QID82_8""}","{""ImportId"":""QID110_FIRST_CLICK""}","{""ImportId"":""QID110_LAST_CLICK""}","{""ImportId"":""QID110_PAGE_SUBMIT""}","{""ImportId"":""QID110_CLICK_COUNT""}","{""ImportId"":""QID83_23""}","{""ImportId"":""QID83_24""}","{""ImportId"":""QID83_25""}","{""ImportId"":""QID83_26""}","{""ImportId"":""QID83_27""}","{""ImportId"":""QID83_28""}","{""ImportId"":""QID111_FIRST_CLICK""}","{""ImportId"":""QID111_LAST_CLICK""}","{""ImportId"":""QID111_PAGE_SUBMIT""}","{""ImportId"":""QID111_CLICK_COUNT""}","{""ImportId"":""QID84_30""}","{""ImportId"":""QID84_31""}","{""ImportId"":""QID84_32""}","{""ImportId"":""QID84_33""}","{""ImportId"":""QID84_34""}","{""ImportId"":""QID84_35""}","{""ImportId"":""QID112_FIRST_CLICK""}","{""ImportId"":""QID112_LAST_CLICK""}","{""ImportId"":""QID112_PAGE_SUBMIT""}","{""ImportId"":""QID112_CLICK_COUNT""}","{""ImportId"":""QID85_31""}","{""ImportId"":""QID85_32""}","{""ImportId"":""QID85_33""}","{""ImportId"":""QID85_34""}","{""ImportId"":""QID85_35""}","{""ImportId"":""QID113_FIRST_CLICK""}","{""ImportId"":""QID113_LAST_CLICK""}","{""ImportId"":""QID113_PAGE_SUBMIT""}","{""ImportId"":""QID113_CLICK_COUNT""}","{""ImportId"":""QID114_50""}","{""ImportId"":""QID114_51""}","{""ImportId"":""QID114_52""}","{""ImportId"":""QID114_53""}","{""ImportId"":""QID114_54""}","{""ImportId"":""QID116_FIRST_CLICK""}","{""ImportId"":""QID116_LAST_CLICK""}","{""ImportId"":""QID116_PAGE_SUBMIT""}","{""ImportId"":""QID116_CLICK_COUNT""}","{""ImportId"":""QID87_37""}","{""ImportId"":""QID87_38""}","{""ImportId"":""QID87_39""}","{""ImportId"":""QID87_40""}","{""ImportId"":""QID87_41""}","{""ImportId"":""QID117_FIRST_CLICK""}","{""ImportId"":""QID117_LAST_CLICK""}","{""ImportId"":""QID117_PAGE_SUBMIT""}","{""ImportId"":""QID117_CLICK_COUNT""}","{""ImportId"":""QID88_41""}","{""ImportId"":""QID88_42""}","{""ImportId"":""QID88_43""}","{""ImportId"":""QID88_44""}","{""ImportId"":""QID88_45""}","{""ImportId"":""QID118_FIRST_CLICK""}","{""ImportId"":""QID118_LAST_CLICK""}","{""ImportId"":""QID118_PAGE_SUBMIT""}","{""ImportId"":""QID118_CLICK_COUNT""}","{""ImportId"":""QID89_45""}","{""ImportId"":""QID89_46""}","{""ImportId"":""QID89_47""}","{""ImportId"":""QID89_48""}","{""ImportId"":""QID89_49""}","{""ImportId"":""QID119_FIRST_CLICK""}","{""ImportId"":""QID119_LAST_CLICK""}","{""ImportId"":""QID119_PAGE_SUBMIT""}","{""ImportId"":""QID119_CLICK_COUNT""}","{""ImportId"":""QID90_56""}","{""ImportId"":""QID90_57""}","{""ImportId"":""QID90_58""}","{""ImportId"":""QID90_59""}","{""ImportId"":""QID90_60""}","{""ImportId"":""QID120_FIRST_CLICK""}","{""ImportId"":""QID120_LAST_CLICK""}","{""ImportId"":""QID120_PAGE_SUBMIT""}","{""ImportId"":""QID120_CLICK_COUNT""}","{""ImportId"":""QID91_63""}","{""ImportId"":""QID91_64""}","{""ImportId"":""QID91_65""}","{""ImportId"":""QID91_66""}","{""ImportId"":""QID91_67""}","{""ImportId"":""QID121_FIRST_CLICK""}","{""ImportId"":""QID121_LAST_CLICK""}","{""ImportId"":""QID121_PAGE_SUBMIT""}","{""ImportId"":""QID121_CLICK_COUNT""}","{""ImportId"":""QID94_69""}","{""ImportId"":""QID94_70""}","{""ImportId"":""QID94_71""}","{""ImportId"":""QID94_72""}","{""ImportId"":""QID94_73""}","{""ImportId"":""QID122_FIRST_CLICK""}","{""ImportId"":""QID122_LAST_CLICK""}","{""ImportId"":""QID122_PAGE_SUBMIT""}","{""ImportId"":""QID122_CLICK_COUNT""}","{""ImportId"":""QID95_79""}","{""ImportId"":""QID95_80""}","{""ImportId"":""QID95_81""}","{""ImportId"":""QID95_82""}","{""ImportId"":""QID95_83""}","{""ImportId"":""QID123_FIRST_CLICK""}","{""ImportId"":""QID123_LAST_CLICK""}","{""ImportId"":""QID123_PAGE_SUBMIT""}","{""ImportId"":""QID123_CLICK_COUNT""}","{""ImportId"":""QID97_76""}","{""ImportId"":""QID97_77""}","{""ImportId"":""QID97_78""}","{""ImportId"":""QID97_79""}","{""ImportId"":""QID97_80""}","{""ImportId"":""QID124_FIRST_CLICK""}","{""ImportId"":""QID124_LAST_CLICK""}","{""ImportId"":""QID124_PAGE_SUBMIT""}","{""ImportId"":""QID124_CLICK_COUNT""}","{""ImportId"":""QID98_80""}","{""ImportId"":""QID98_81""}","{""ImportId"":""QID98_82""}","{""ImportId"":""QID98_83""}","{""ImportId"":""QID98_84""}","{""ImportId"":""QID125_FIRST_CLICK""}","{""ImportId"":""QID125_LAST_CLICK""}","{""ImportId"":""QID125_PAGE_SUBMIT""}","{""ImportId"":""QID125_CLICK_COUNT""}","{""ImportId"":""QID149""}","{""ImportId"":""QID150""}","{""ImportId"":""QID151_TEXT""}","{""ImportId"":""QID152_TEXT""}","{""ImportId"":""QID153""}","{""ImportId"":""QID154""}","{""ImportId"":""QID155""}","{""ImportId"":""QID156""}","{""ImportId"":""QID157""}","{""ImportId"":""QID158""}","{""ImportId"":""QID159""}","{""ImportId"":""QID160""}","{""ImportId"":""QID161""}","{""ImportId"":""QID162_TEXT""}","{""ImportId"":""QID72_TEXT""}",1e4c866bda044438,"{""ImportId"":""assignmentId""}","{""ImportId"":""hitId""}","{""ImportId"":""study_time""}","{""ImportId"":""payment""}","{""ImportId"":""condition""}"
4/19/18 9:19,4/19/18 9:24,0,0c656a00a6b6b778,100,296,1,4/19/18 9:24,R_3enyixNHV0DVYdE,,,,,,,anonymous,EN,,,,,,,,,,,,,,,,,,,,,3,6,5,5,5,4.186,14.953,16.52,6,4,6,6,3,1,2,2.589,16.634,17.441,6,7,4,5,7,1,5,3.839,16.082,16.981,9,3,4,6,2,3,2.961,15.427,16.021,5,2,6,3,1,6,4.893,14.117,14.937,5,6,3,4,5,1,4.647,15.528,18.816,5,2,5,3,5,3,4.626,10.545,14.131,5,3,4,5,5,6,2.608,8.874,10.241,5,3,5,6,4,2,5.375,15.214,15.851,6,7,7,7,7,1,2.264,13.993,14.634,5,6,5,3,4,5,4.709,12.339,12.869,5,7,2,5,7,2,5.305,17.302,17.928,5,4,7,6,2,3,4.949,17.953,21.007,6,6,7,3,5,4,4.403,13.345,13.955,5,1,2,17,15,,0,1,0,1,0,0,0,1,,,e0520e239fd4b01f,,3R4QIDVOJPCGNS60KFHQO1K6X6NEEY,10,1.35,noInterv
4/19/18 9:19,4/19/18 9:26,0,053ac4849cef2539,100,396,1,4/19/18 9:26,R_22yNGTOQrGZid4C,,,,,,,anonymous,EN,,,,,,,,,,,,,,,,,,,,,7,4,4,4,5,2.578,16.226,16.983,7,7,4,6,5,4,1,1.948,14.888,15.492,7,5,3,7,7,1,3,67.898,89.169,90.133,9,4,4,4,4,4,3.404,6.758,7.72,5,1,7,6,1,7,2.209,14.34,14.825,8,4,7,4,4,1,3.77,40.057,41.014,10,4,4,4,4,3,2.674,9.791,10.346,7,4,4,4,4,6,1.881,11.506,12.019,9,4,4,4,4,4,1.962,7.584,10.527,6,4,4,4,4,4,2.816,14.765,16.73,9,4,3,3,3,5,3.04,13.197,13.785,8,4,4,4,4,4,2.635,5.869,7.242,5,4,4,4,4,4,21.836,56.648,59.246,19,7,5,6,3,4,2.707,17.111,18.044,6,0,,,,0,0,0,,,,,,1,,,1482be7bec1cbbf6,,3R4QIDVOJPCGNS60KFHQO1K6X6NEEY,10,1.35,noInterv
